{
	"schemaVersion": "1.0.0",
	"id": "sw-reup",
	"type": "rulebook",
	"title": "Star Wars Roleplaying Game: Revised, Expanded and Updated",
	"authors": [
		"The REUP Team"
	],
	"source": {
		"document": "Kodex.pdf"
	},
	"blocks": [
		{
			"id": "section.player",
			"type": "section",
			"title": "Player Section",
			"blocks": [
				{
					"id": "chapter.01.introduction",
					"type": "chapter",
					"number": 1,
					"label": "Chapter One",
					"title": "Introduction",
					"blocks": []
				},
				{
					"id": "chapter.02.characters",
					"type": "chapter",
					"number": 2,
					"label": "Chapter Two",
					"title": "Characters",
					"blocks": []
				},
				{
					"id": "chapter.03.attributes_and_skills",
					"type": "chapter",
					"number": 3,
					"title": "Attribute & Skills",
					"label": "Chapter Three",
					"source": {
						"page_start": 34,
						"page_end": 35
					},
					"tags": [
						"skills"
					],
					"blocks": [
						{
							"type": "chapter_intro",
							"text": "Now that I've talked you through character generation, we're going to get down to what really makes your character work: attributes and skills. You've basically defined who your character is, what he's like, and what he is capable of doing. Your character's a little like a starship. In creating a starship (or commissioning one to be built for you), you define the vessel you'll be flying. But you can't do anything until you know how to fly it. You can't do much with your character until you know the finer details of how to run him. In this chapter, you'll learn how specific skills and attributes work so your character can tackle all the challenges waiting out there in the galaxy."
						},
						{
							"type": "chapter_intro",
							"text": "Just like in the \"Characters\" chapter, I've conveniently marked the stuff you need to know with tan boxes. The other stuff is an explanation of how each skill works, and it's there mostly for the benefit of the gamemaster: it provides some general guidelines and some specific examples of how to set difficulty numbers when you try to use the skill."
						},
						{
							"type": "chapter_intro",
							"text": "By now you've probably figured out that characters in the Star Wars game have six attributes: Dexterity, Knowledge, Mechanical, Perception, Strength and Technical. Each attribute covers many skills."
						},
						{
							"type": "intro",
							"text": "Using attributes and skills is easy if you follow one simple concept. It's called the \"Star Wars Rule of Thumb.\""
						},
						{
							"type": "rule_summary",
							"text": "Pick a difficulty number. If the character's skill roll is equal or higher, she succeeds."
						},
						{
							"type": "intro",
							"text": "When you want your character to do something, the gamemaster picks a difficulty number. (All the lists and explanations in this chapter tell him how to figure out what the difficulty number should be.) If you roll equal to or higher than the difficulty number, your character succeeded at what she was trying to do."
						},
						{
							"type": "intro",
							"text": "Now you know the one major rule you need to play this game."
						},
						{
							"type": "stat_block",
							"title": "Skill Descriptions",
							"fields": {
								"time_taken": "This is generally how long it takes to do something with the skill. Many skills (especially combat skills) can be used in one round. More complex skills, like computer programming/repair, may take a round... or minutes, hours or even days to do something. These are general guidelines; the gamemaster can always customize the time taken depending upon the situation.",
								"specializations": "Characters may choose a specialization for a skill. The kinds of specializations are explained, and several examples are provided in <i>italics</i>."
							},
							"blocks": [
								{
									"type": "description",
									"text": "The skill description tells you what the skill covers and gives a few sample difficulties and modifiers."
								}
							]
						},
						{
							"id": "skill_group.dexterity",
							"type": "skill_group",
							"title": "Dexterity Skills",
							"source": {
								"page_start": 35,
								"page_end": 37
							},
							"blocks": [
								{
									"type": "paragraph",
									"text": "Dexterity is a measure of your character's eye-hand coordination and balance. Characters with a high Dexterity are good shots, can dodge blaster bolts, can walk balance beams with ease and even make good pick-pockets. Characters with a low Dexterity are clumsy."
								},
								{
									"id": "rule.dexterity.ranged_combat_skills",
									"type": "rule_section",
									"title": "Using Ranged Combat Skills",
									"blocks": [
										{
											"type": "paragraph",
											"text": "Dexterity has several \"ranged combat\" skills covering weapons that can be used to attack someone from a distance. These skills all work the same way."
										},
										{
											"type": "paragraph",
											"text": "When a character shoots a ranged weapon, the difficulty number is based on the range to the target: the further away a target, the higher the difficulty number. (Each weapon has different ranges; weapons are described in the chapter on \"Weapons & Equipment.\")"
										},
										{
											"type": "paragraph",
											"text": "If your skill roll is equal to or greater than the difficulty number, your attack hits."
										},
										{
											"type": "paragraph",
											"text": "It's not always that simple, however - the target might dodge (that's a \"reaction skill\") or might be partially protected by cover. This is explained in the chapter on \"Combat and Injuries.\""
										},
										{
											"type": "paragraph",
											"text": "The \"ranged combat\" skills include: archaic guns, artillery, blaster, blaster artillery, bowcaster, bows, firearms, flamethrower, grenade, missile weapons, thrown weapons and vehicle blasters. (Starship gunnery and capital ship gunnery are also \"ranged combat\" skills, but they're covered by Mechanical.)"
										}
									]
								},
								{
									"id": "rule.dexterity.melee_combat_skills",
									"type": "rule_section",
									"title": "Using Melee Combat Skills",
									"blocks": [
										{
											"type": "paragraph",
											"text": "Dexterity has \"melee combat\" skills which cover any type of hand-to-hand attack. They're melee combat and lightsaber; brawling - a Strength skill - is also a melee combat skill."
										},
										{
											"type": "paragraph",
											"text": "Each melee weapon has a different difficulty number. (The weapons are described in the chapter on \"Weapons & Equipment.\") If the character rolls equal to or higher than the difficulty number, the attack hits."
										},
										{
											"type": "paragraph",
											"text": "Of course, just like ranged combat skills, it's not always that simple. The target might parry the attack using a \"reaction skill\" or might be partially protected by cover. This is explained in the chapter on \"Combat & Injuries.\""
										}
									]
								},
								{
									"id": "rule.dexterity.reaction_skills",
									"type": "rule_section",
									"title": "Using Reaction Skills",
									"blocks": [
										{
											"type": "paragraph",
											"text": "Dexterity covers several \"reaction skills,\" which are used to avoid or block attacks. When your character is attacked and you roll a \"reaction skill,\" the attacker's difficulty number is now whatever you roll."
										},
										{
											"type": "paragraph",
											"text": "There are several reaction skills: acrobatics, brawling parry, dodge and melee parry. Lightsaber can also be used to parry attacks. The many vehicle operation and starship piloting skills they're all under Mechanical - can also be used for \"vehicle dodges\" to avoid enemy fire."
										},
										{
											"type": "paragraph",
											"text": "A reaction skill can also be used for a \"full reaction.\" The character rolls the reaction skill - acrobatics, brawling parry, dodge, melee parry, parries with a lightsaber, or a vehicle or starship dodge - and adds the roll to the attackers' difficulty numbers. However, a character making a full reaction can't do anything else in the round."
										},
										{
											"type": "paragraph",
											"text": "The chapter on \"Combat and Injuries\" fully explains how to use reaction skills."
										}
									]
								},
								{
									"id": "skill.acrobatics",
									"type": "skill",
									"title": "Acrobatics",
									"source": {
										"page_start": 35,
										"page_end": 37
									},
									"fields": {
										"time_taken": "One round",
										"specializations": "Type of acrobatics used, form or style",
										"examples": "diving, trapeze, tumbling"
									},
									"blocks": [
										{
											"type": "description",
											"text": "Characters with this skill can tumble, leap, and roll to avoid falling damage, to entertain an audience, or to surprise an opponent in combat."
										},
										{
											"type": "paragraph",
											"text": "Using acrobatics can improve many of a character's climbing/jumping and running attempts. The gamemaster determines the difficulty of the acrobatics stunt. One-half of the difference (rounded up) between the difficulty and the acrobatics roll is added to the complementary skill. The acrobatics attempt and the climbing/jumping or running try must be done on the same turn, incurring a multiple action penalty."
										},
										{
											"type": "paragraph",